{
  "$schema": "../../../schemas/library.json",
  "name": "FancyComponents",
  "description": "Growing library of ready-to-use React components",
  "author": "FancyComponents Team",
  "repository": "",
  "homepage": "https://www.fancycomponents.dev/",
  "registryUrl": "https://www.fancycomponents.dev/r",
  "installCommand": "npx shadcn@latest add",
  "tags": ["react", "ready-to-use", "ui-library"],
  "category": "libraries",
  "status": "production",
  "license": "MIT",
  "shadcnCompatible": true,
  "features": [
    "Ready-to-use React components",
    "Growing component library",
    "Professional UI elements"
  ],
  "version": "1.0.0",
  "lastUpdated": "2025-01-15"
}