{
  "$schema": "../../../schemas/library.json",
  "name": "BundUI",
  "description": "TypeScript-compatible component library that supports shadcn/ui",
  "author": "BundUI Team",
  "repository": "https://github.com/bundui/components",
  "homepage": "https://bundui.io/",
  "registryUrl": "https://bundui.io/r",
  "installCommand": "npx shadcn@latest add",
  "tags": ["typescript", "react", "tailwind", "shadcn-compatible"],
  "category": "libraries",
  "status": "production",
  "license": "MIT",
  "shadcnCompatible": true,
  "features": [
    "TypeScript support (88.7% of codebase)",
    "Tailwind CSS integration",
    "shadcn/ui compatibility",
    "Comprehensive documentation"
  ],
  "version": "1.0.0",
  "lastUpdated": "2025-01-15"
}